{
  "schema_version": "1.0",
  "product_name": "Skeleton Glow Touchscreen Gloves",
  "sku": "SGG-BLK-1P-DEFR",
  "quantity": "1 Pair",
  "color": "Black",
  "material": "95% polyester, 5% elastane",
  "dimensions": {"length_cm": 22, "palm_width_cm": 9.5},
  "weight_g": 82,
  "packaging": "Recyclable paper sleeve",
  "target_audience": "Adults and teenagers 14+",
  "core_functions": ["Glow-in-the-dark bone print", "Touchscreen index finger", "Stretch knit fit"],
  "compliance": {"GPSR": true, "REACH": true, "TEXTILE_LABEL": true, "PACKAGING_EPR": true},
  "brand": "ExampleBrand",
  "ean": "4012345678901",
  "manufacturer": "Example Manufacturing Co., Ltd.",
  "responsible_person": "Example EU Responsible Person GmbH, Berlin, Germany",
  "country_of_origin": "China",
  "target_price": 12.99,
  "currency": "EUR",
  "initial_inventory": 300
}
